DOI,Title,relevant
10.1016/j.apjtm.2017.10.018,Comparative molecular docking studies of lupeol and lupenone isolated from Pueraria lobata that inhibits BACE1: Probable remedies for Alzheimer's disease,FALSE
10.4161/auto.7.12.18051,Macroautophagy-generated increase of lysosomal amyloid β-protein mediates oxidant-induced apoptosis of cultured neuroblastoma cells,FALSE
10.1021/ja802210u,Nitrogen-14 solid-state NMR spectroscopy of aligned phospholipid bilayers to probe peptide-lipid interaction and oligomerization of membrane associated peptides,FALSE
10.1038/cdd.2010.111,Human-IAPP disrupts the autophagy/lysosomal pathway in pancreatic β-cells: protective role of p62-positive cytoplasmic inclusions,FALSE
10.1111/cbdd.12555,Insights into the Interaction Mechanism of Ligands with Aβ42 Based on Molecular Dynamics Simulations and Mechanics: Implications of Role of Common Binding Site in Drug Design for Alzheimer's Disease,FALSE
10.1155/2021/2031407,MiR-29c-3p May Promote the Progression of Alzheimer's Disease through BACE1,FALSE
10.3390/ijms21228661,Clinical Utility of the Pathogenesis-Related Proteins in Alzheimer's Disease,FALSE
10.1074/jbc.m115.712455,Differential Activation of Innate Immune Pathways by Distinct Islet Amyloid Polypeptide (IAPP) Aggregates,FALSE
10.1080/1061186x.2022.2063297,Formulation development of tocopherol polyethylene glycol nanoengineered polyamidoamine dendrimer for neuroprotection and treatment of Alzheimer disease,FALSE
10.1186/s13195-021-00940-2,Plasma MCP-1 and changes on cognitive function in community-dwelling older adults,FALSE
10.1073/pnas.1219059110,Common mechanism unites membrane poration by amyloid and antimicrobial peptides,FALSE
10.1016/j.celrep.2022.111062,Inhibition of SIRT2 promotes APP acetylation and ameliorates cognitive impairment in APP/PS1 transgenic mice,FALSE
10.1074/jbc.m610390200,Soluble Abeta inhibits specific signal transduction cascades common to the insulin receptor pathway,FALSE
